22:49:37.194789 ARP, Request who-has 192.168.43.116 tell 192.168.43.1, length 28
22:49:37.194802 ARP, Reply 192.168.43.116 is-at d8:5d:e2:cb:b2:f1, length 28
22:50:03.195276 ARP, Request who-has 192.168.43.116 tell 192.168.43.1, length 28
22:50:03.195284 ARP, Reply 192.168.43.116 is-at d8:5d:e2:cb:b2:f1, length 28
22:50:14.689373 ARP, Request who-has 192.168.43.127 tell 192.168.43.1, length 28
22:50:16.736500 ARP, Request who-has 192.168.43.127 tell 192.168.43.1, length 28
22:50:25.543350 ARP, Request who-has 192.168.43.127 tell 192.168.43.1, length 28
22:50:28.884829 ARP, Request who-has 192.168.43.127 tell 192.168.43.1, length 28
22:50:29.993803 ARP, Request who-has 192.168.43.127 tell 192.168.43.1, length 28
22:50:31.072990 ARP, Request who-has 192.168.43.127 tell 192.168.43.1, length 28
22:50:31.073960 ARP, Request who-has 192.168.43.116 tell 192.168.43.1, length 28
22:50:31.073965 ARP, Reply 192.168.43.116 is-at d8:5d:e2:cb:b2:f1, length 28
22:50:31.956821 ARP, Request who-has 192.168.43.127 tell 192.168.43.1, length 28
22:50:32.952358 ARP, Request who-has 192.168.43.127 tell 192.168.43.1, length 28
22:50:35.067604 ARP, Request who-has 192.168.43.127 tell 192.168.43.1, length 28
22:50:37.215970 ARP, Request who-has 192.168.43.127 tell 192.168.43.1, length 28
22:50:39.267593 ARP, Request who-has 192.168.43.127 tell 192.168.43.1, length 28
22:50:45.407516 ARP, Request who-has 192.168.43.127 tell 192.168.43.1, length 28
22:50:46.301519 ARP, Request who-has 192.168.43.127 tell 192.168.43.1, length 28
22:50:47.455979 ARP, Request who-has 192.168.43.127 tell 192.168.43.1, length 28
22:50:49.505311 ARP, Request who-has 192.168.43.127 tell 192.168.43.1, length 28
22:50:51.552651 ARP, Request who-has 192.168.43.127 tell 192.168.43.1, length 28
22:50:53.600608 ARP, Request who-has 192.168.43.127 tell 192.168.43.1, length 28
22:50:55.649430 ARP, Request who-has 192.168.43.127 tell 192.168.43.1, length 28
22:50:57.695174 ARP, Request who-has 192.168.43.127 tell 192.168.43.1, length 28
22:50:59.744881 ARP, Request who-has 192.168.43.127 tell 192.168.43.1, length 28
22:51:01.791952 ARP, Request who-has 192.168.43.127 tell 192.168.43.1, length 28
22:51:03.841322 ARP, Request who-has 192.168.43.127 tell 192.168.43.1, length 28
22:51:05.888565 ARP, Request who-has 192.168.43.127 tell 192.168.43.1, length 28
22:51:07.936235 ARP, Request who-has 192.168.43.127 tell 192.168.43.1, length 28
22:51:09.982762 ARP, Request who-has 192.168.43.127 tell 192.168.43.1, length 28
22:51:12.030643 ARP, Request who-has 192.168.43.127 tell 192.168.43.1, length 28
22:51:12.939902 ARP, Request who-has 192.168.43.127 tell 192.168.43.1, length 28
22:51:14.079787 ARP, Request who-has 192.168.43.127 tell 192.168.43.1, length 28
22:51:16.127424 ARP, Request who-has 192.168.43.127 tell 192.168.43.1, length 28
