15:09:42.000706 ARP, Request who-has 172.16.227.162 tell 172.16.224.1, length 42
15:09:42.615421 ARP, Request who-has 172.16.230.92 tell 172.16.224.1, length 42
15:09:43.229544 ARP, Request who-has 172.16.230.132 tell 172.16.228.15, length 46
15:09:43.229550 ARP, Request who-has 172.16.224.1 tell 172.16.224.210, length 46
15:09:43.639495 ARP, Request who-has 172.16.227.241 tell 172.16.224.187, length 46
15:09:43.639500 ARP, Request who-has 172.16.225.132 tell 172.16.224.1, length 42
15:09:43.639503 ARP, Request who-has 172.16.226.65 tell 172.16.224.1, length 42
15:09:43.639504 ARP, Request who-has 172.16.230.92 tell 172.16.224.1, length 42
15:09:43.843807 ARP, Request who-has 172.16.229.223 tell 172.16.224.1, length 42
15:09:44.253348 ARP, Request who-has 172.16.230.132 tell 172.16.228.15, length 46
15:09:44.867623 ARP, Request who-has 172.16.229.223 tell 172.16.224.1, length 42
15:09:45.072452 ARP, Request who-has 172.16.231.67 tell 172.16.224.210, length 46
15:09:45.891902 ARP, Request who-has 172.16.229.223 tell 172.16.224.1, length 42
15:09:46.096782 ARP, Request who-has 172.16.227.93 tell 172.16.227.68, length 42
15:09:46.301616 ARP, Request who-has 172.16.230.132 tell 172.16.228.15, length 46
