22:39:29.835138 IP 202.153.32.19.443 > 192.168.43.116.34204: Flags [.], seq 3548745135:3548746543, ack 2329981329, win 135, options [nop,nop,TS val 190970858 ecr 395341], length 1408
22:39:29.835371 IP 202.153.32.19.443 > 192.168.43.116.34204: Flags [.], seq 1408:2816, ack 1, win 135, options [nop,nop,TS val 190970858 ecr 395341], length 1408
22:39:29.835422 IP 192.168.43.116.34204 > 202.153.32.19.443: Flags [.], ack 2816, win 8106, options [nop,nop,TS val 395371 ecr 190970858], length 0
22:39:29.835699 IP 202.153.32.19.443 > 192.168.43.116.34204: Flags [.], seq 2816:4224, ack 1, win 135, options [nop,nop,TS val 190970858 ecr 395341], length 1408
22:39:29.835996 IP 202.153.32.19.443 > 192.168.43.116.34204: Flags [.], seq 4224:5632, ack 1, win 135, options [nop,nop,TS val 190970858 ecr 395341], length 1408
22:39:29.836004 IP 192.168.43.116.34204 > 202.153.32.19.443: Flags [.], ack 5632, win 8106, options [nop,nop,TS val 395371 ecr 190970858], length 0
22:39:29.873218 IP 202.153.32.19.443 > 192.168.43.116.34204: Flags [.], seq 5632:7040, ack 1, win 135, options [nop,nop,TS val 190970913 ecr 395358], length 1408
22:39:29.873478 IP 202.153.32.19.443 > 192.168.43.116.34204: Flags [.], seq 7040:8448, ack 1, win 135, options [nop,nop,TS val 190970913 ecr 395358], length 1408
22:39:29.873493 IP 192.168.43.116.34204 > 202.153.32.19.443: Flags [.], ack 8448, win 8106, options [nop,nop,TS val 395380 ecr 190970913], length 0
22:39:29.906086 IP 202.153.32.19.443 > 192.168.43.116.34204: Flags [.], seq 8448:9856, ack 1, win 135, options [nop,nop,TS val 190970933 ecr 395362], length 1408
22:39:29.906106 IP 202.153.32.19.443 > 192.168.43.116.34204: Flags [.], seq 9856:11264, ack 1, win 135, options [nop,nop,TS val 190970933 ecr 395362], length 1408
22:39:29.906116 IP 192.168.43.116.34204 > 202.153.32.19.443: Flags [.], ack 11264, win 8106, options [nop,nop,TS val 395389 ecr 190970933], length 0
22:39:29.906305 IP 202.153.32.19.443 > 192.168.43.116.34204: Flags [.], seq 11264:12672, ack 1, win 135, options [nop,nop,TS val 190970938 ecr 395363], length 1408
22:39:29.931589 IP 202.153.32.19.443 > 192.168.43.116.34204: Flags [.], seq 12672:14080, ack 1, win 135, options [nop,nop,TS val 190970938 ecr 395363], length 1408
22:39:29.931636 IP 192.168.43.116.34204 > 202.153.32.19.443: Flags [.], ack 14080, win 8106, options [nop,nop,TS val 395395 ecr 190970938], length 0
22:39:29.931647 IP 202.153.32.19.443 > 192.168.43.116.34204: Flags [.], seq 14080:15488, ack 1, win 135, options [nop,nop,TS val 190970938 ecr 395363], length 1408
22:39:29.931657 IP 202.153.32.19.443 > 192.168.43.116.34204: Flags [.], seq 15488:16896, ack 1, win 135, options [nop,nop,TS val 190970938 ecr 395363], length 1408
22:39:29.931661 IP 192.168.43.116.34204 > 202.153.32.19.443: Flags [.], ack 16896, win 8106, options [nop,nop,TS val 395395 ecr 190970938], length 0
22:39:29.931664 IP 202.153.32.19.443 > 192.168.43.116.34204: Flags [.], seq 16896:18304, ack 1, win 135, options [nop,nop,TS val 190970938 ecr 395363], length 1408
22:39:29.931668 IP 202.153.32.19.443 > 192.168.43.116.34204: Flags [.], seq 18304:19712, ack 1, win 135, options [nop,nop,TS val 190970938 ecr 395363], length 1408
22:39:29.931671 IP 192.168.43.116.34204 > 202.153.32.19.443: Flags [.], ack 19712, win 8106, options [nop,nop,TS val 395395 ecr 190970938], length 0
22:39:29.931679 IP 202.153.32.19.443 > 192.168.43.116.34204: Flags [.], seq 19712:21120, ack 1, win 135, options [nop,nop,TS val 190970943 ecr 395365], length 1408
22:39:29.931681 IP 202.153.32.19.443 > 192.168.43.116.34204: Flags [.], seq 21120:22528, ack 1, win 135, options [nop,nop,TS val 190970943 ecr 395365], length 1408
22:39:29.931685 IP 192.168.43.116.34204 > 202.153.32.19.443: Flags [.], ack 22528, win 8106, options [nop,nop,TS val 395395 ecr 190970943], length 0
22:39:29.931686 IP 202.153.32.19.443 > 192.168.43.116.34204: Flags [.], seq 22528:23936, ack 1, win 135, options [nop,nop,TS val 190970943 ecr 395365], length 1408
22:39:29.931688 IP 202.153.32.19.443 > 192.168.43.116.34204: Flags [.], seq 23936:25344, ack 1, win 135, options [nop,nop,TS val 190970943 ecr 395365], length 1408
22:39:29.931690 IP 192.168.43.116.34204 > 202.153.32.19.443: Flags [.], ack 25344, win 8106, options [nop,nop,TS val 395395 ecr 190970943], length 0
22:39:29.935313 IP 202.153.32.19.443 > 192.168.43.116.34204: Flags [.], seq 25344:26752, ack 1, win 135, options [nop,nop,TS val 190970948 ecr 395365], length 1408
22:39:29.935590 IP 202.153.32.19.443 > 192.168.43.116.34204: Flags [.], seq 26752:28160, ack 1, win 135, options [nop,nop,TS val 190970948 ecr 395365], length 1408
22:39:29.935609 IP 192.168.43.116.34204 > 202.153.32.19.443: Flags [.], ack 28160, win 8106, options [nop,nop,TS val 395396 ecr 190970948], length 0
22:39:29.935620 IP 202.153.32.19.443 > 192.168.43.116.34204: Flags [.], seq 28160:29568, ack 1, win 135, options [nop,nop,TS val 190970948 ecr 395365], length 1408
22:39:29.935869 IP 202.153.32.19.443 > 192.168.43.116.34204: Flags [.], seq 29568:30976, ack 1, win 135, options [nop,nop,TS val 190970948 ecr 395365], length 1408
22:39:29.935878 IP 192.168.43.116.34204 > 202.153.32.19.443: Flags [.], ack 30976, win 8106, options [nop,nop,TS val 395396 ecr 190970948], length 0
22:39:29.935883 IP 202.153.32.19.443 > 192.168.43.116.34204: Flags [.], seq 30976:32384, ack 1, win 135, options [nop,nop,TS val 190970948 ecr 395365], length 1408
22:39:29.935885 IP 202.153.32.19.443 > 192.168.43.116.34204: Flags [.], seq 32384:33792, ack 1, win 135, options [nop,nop,TS val 190970948 ecr 395365], length 1408
22:39:29.935889 IP 192.168.43.116.34204 > 202.153.32.19.443: Flags [.], ack 33792, win 8106, options [nop,nop,TS val 395396 ecr 190970948], length 0
22:39:29.936179 IP 202.153.32.19.443 > 192.168.43.116.34204: Flags [.], seq 33792:35200, ack 1, win 135, options [nop,nop,TS val 190970962 ecr 395370], length 1408
22:39:29.936490 IP 202.153.32.19.443 > 192.168.43.116.34204: Flags [.], seq 35200:36608, ack 1, win 135, options [nop,nop,TS val 190970962 ecr 395370], length 1408
22:39:29.936495 IP 192.168.43.116.34204 > 202.153.32.19.443: Flags [.], ack 36608, win 8106, options [nop,nop,TS val 395396 ecr 190970962], length 0
22:39:29.936804 IP 202.153.32.19.443 > 192.168.43.116.34204: Flags [.], seq 36608:38016, ack 1, win 135, options [nop,nop,TS val 190970962 ecr 395370], length 1408
22:39:29.937100 IP 202.153.32.19.443 > 192.168.43.116.34204: Flags [.], seq 38016:39424, ack 1, win 135, options [nop,nop,TS val 190970962 ecr 395370], length 1408
22:39:29.937111 IP 192.168.43.116.34204 > 202.153.32.19.443: Flags [.], ack 39424, win 8106, options [nop,nop,TS val 395396 ecr 190970962], length 0
22:39:29.937428 IP 202.153.32.19.443 > 192.168.43.116.34204: Flags [.], seq 39424:40832, ack 1, win 135, options [nop,nop,TS val 190970967 ecr 395371], length 1408
22:39:29.937739 IP 202.153.32.19.443 > 192.168.43.116.34204: Flags [.], seq 40832:42240, ack 1, win 135, options [nop,nop,TS val 190970967 ecr 395371], length 1408
22:39:29.937744 IP 192.168.43.116.34204 > 202.153.32.19.443: Flags [.], ack 42240, win 8106, options [nop,nop,TS val 395397 ecr 190970967], length 0
22:39:29.938050 IP 202.153.32.19.443 > 192.168.43.116.34204: Flags [.], seq 42240:43648, ack 1, win 135, options [nop,nop,TS val 190970972 ecr 395371], length 1408
22:39:29.938367 IP 202.153.32.19.443 > 192.168.43.116.34204: Flags [.], seq 43648:45056, ack 1, win 135, options [nop,nop,TS val 190970972 ecr 395371], length 1408
22:39:29.938372 IP 192.168.43.116.34204 > 202.153.32.19.443: Flags [.], ack 45056, win 8106, options [nop,nop,TS val 395397 ecr 190970972], length 0
22:39:29.964134 IP 202.153.32.19.443 > 192.168.43.116.34204: Flags [.], seq 45056:46464, ack 1, win 135, options [nop,nop,TS val 190971002 ecr 395380], length 1408
22:39:29.964449 IP 202.153.32.19.443 > 192.168.43.116.34204: Flags [.], seq 46464:47872, ack 1, win 135, options [nop,nop,TS val 190971002 ecr 395380], length 1408
22:39:29.964464 IP 192.168.43.116.34204 > 202.153.32.19.443: Flags [.], ack 47872, win 8106, options [nop,nop,TS val 395403 ecr 190971002], length 0
22:39:30.022815 IP 202.153.32.19.443 > 192.168.43.116.34204: Flags [.], seq 47872:49280, ack 1, win 135, options [nop,nop,TS val 190971062 ecr 395389], length 1408
22:39:30.023124 IP 202.153.32.19.443 > 192.168.43.116.34204: Flags [.], seq 49280:50688, ack 1, win 135, options [nop,nop,TS val 190971062 ecr 395389], length 1408
22:39:30.023138 IP 192.168.43.116.34204 > 202.153.32.19.443: Flags [.], ack 50688, win 8106, options [nop,nop,TS val 395418 ecr 190971062], length 0
22:39:30.023427 IP 202.153.32.19.443 > 192.168.43.116.34204: Flags [.], seq 50688:52096, ack 1, win 135, options [nop,nop,TS val 190971062 ecr 395395], length 1408
22:39:30.023731 IP 202.153.32.19.443 > 192.168.43.116.34204: Flags [.], seq 52096:53504, ack 1, win 135, options [nop,nop,TS val 190971062 ecr 395395], length 1408
22:39:30.023739 IP 192.168.43.116.34204 > 202.153.32.19.443: Flags [.], ack 53504, win 8106, options [nop,nop,TS val 395418 ecr 190971062], length 0
22:39:30.024047 IP 202.153.32.19.443 > 192.168.43.116.34204: Flags [.], seq 53504:54912, ack 1, win 135, options [nop,nop,TS val 190971062 ecr 395395], length 1408
22:39:30.028333 IP 202.153.32.19.443 > 192.168.43.116.34204: Flags [.], seq 54912:56320, ack 1, win 135, options [nop,nop,TS val 190971062 ecr 395395], length 1408
22:39:30.028372 IP 192.168.43.116.34204 > 202.153.32.19.443: Flags [.], ack 56320, win 8106, options [nop,nop,TS val 395419 ecr 190971062], length 0
22:39:30.038052 IP 202.153.32.19.443 > 192.168.43.116.34204: Flags [.], seq 56320:57728, ack 1, win 135, options [nop,nop,TS val 190971062 ecr 395395], length 1408
22:39:30.038072 IP 202.153.32.19.443 > 192.168.43.116.34204: Flags [P.], seq 57728:59136, ack 1, win 135, options [nop,nop,TS val 190971062 ecr 395395], length 1408
22:39:30.038084 IP 192.168.43.116.34204 > 202.153.32.19.443: Flags [.], ack 59136, win 8106, options [nop,nop,TS val 395422 ecr 190971062], length 0
22:39:30.038349 IP 202.153.32.19.443 > 192.168.43.116.34204: Flags [.], seq 59136:60544, ack 1, win 135, options [nop,nop,TS val 190971062 ecr 395395], length 1408
22:39:30.038359 IP 202.153.32.19.443 > 192.168.43.116.34204: Flags [.], seq 60544:61952, ack 1, win 135, options [nop,nop,TS val 190971062 ecr 395395], length 1408
22:39:30.038367 IP 192.168.43.116.34204 > 202.153.32.19.443: Flags [.], ack 61952, win 8106, options [nop,nop,TS val 395422 ecr 190971062], length 0
22:39:30.038663 IP 202.153.32.19.443 > 192.168.43.116.34204: Flags [.], seq 61952:63360, ack 1, win 135, options [nop,nop,TS val 190971062 ecr 395395], length 1408
22:39:30.038673 IP 202.153.32.19.443 > 192.168.43.116.34204: Flags [.], seq 63360:64768, ack 1, win 135, options [nop,nop,TS val 190971062 ecr 395395], length 1408
22:39:30.038681 IP 192.168.43.116.34204 > 202.153.32.19.443: Flags [.], ack 64768, win 8106, options [nop,nop,TS val 395422 ecr 190971062], length 0
22:39:30.038685 IP 202.153.32.19.443 > 192.168.43.116.34204: Flags [.], seq 64768:66176, ack 1, win 135, options [nop,nop,TS val 190971072 ecr 395396], length 1408
22:39:30.038974 IP 202.153.32.19.443 > 192.168.43.116.34204: Flags [.], seq 66176:67584, ack 1, win 135, options [nop,nop,TS val 190971072 ecr 395396], length 1408
22:39:30.038985 IP 192.168.43.116.34204 > 202.153.32.19.443: Flags [.], ack 67584, win 8106, options [nop,nop,TS val 395422 ecr 190971072], length 0
22:39:30.039285 IP 202.153.32.19.443 > 192.168.43.116.34204: Flags [.], seq 67584:68992, ack 1, win 135, options [nop,nop,TS val 190971072 ecr 395396], length 1408
22:39:30.039597 IP 202.153.32.19.443 > 192.168.43.116.34204: Flags [.], seq 68992:70400, ack 1, win 135, options [nop,nop,TS val 190971072 ecr 395396], length 1408
22:39:30.039609 IP 192.168.43.116.34204 > 202.153.32.19.443: Flags [.], ack 70400, win 8106, options [nop,nop,TS val 395422 ecr 190971072], length 0
22:39:30.039888 IP 202.153.32.19.443 > 192.168.43.116.34204: Flags [.], seq 70400:71808, ack 1, win 135, options [nop,nop,TS val 190971073 ecr 395396], length 1408
22:39:30.040221 IP 202.153.32.19.443 > 192.168.43.116.34204: Flags [.], seq 71808:73216, ack 1, win 135, options [nop,nop,TS val 190971073 ecr 395396], length 1408
22:39:30.040233 IP 192.168.43.116.34204 > 202.153.32.19.443: Flags [.], ack 73216, win 8106, options [nop,nop,TS val 395422 ecr 190971073], length 0
22:39:30.040532 IP 202.153.32.19.443 > 192.168.43.116.34204: Flags [.], seq 73216:74624, ack 1, win 135, options [nop,nop,TS val 190971073 ecr 395396], length 1408
22:39:30.040854 IP 202.153.32.19.443 > 192.168.43.116.34204: Flags [.], seq 74624:76032, ack 1, win 135, options [nop,nop,TS val 190971073 ecr 395396], length 1408
22:39:30.040865 IP 192.168.43.116.34204 > 202.153.32.19.443: Flags [.], ack 76032, win 8106, options [nop,nop,TS val 395422 ecr 190971073], length 0
22:39:30.041149 IP 202.153.32.19.443 > 192.168.43.116.34204: Flags [.], seq 76032:77440, ack 1, win 135, options [nop,nop,TS val 190971073 ecr 395396], length 1408
22:39:30.041465 IP 202.153.32.19.443 > 192.168.43.116.34204: Flags [.], seq 77440:78848, ack 1, win 135, options [nop,nop,TS val 190971073 ecr 395396], length 1408
22:39:30.041469 IP 192.168.43.116.34204 > 202.153.32.19.443: Flags [.], ack 78848, win 8106, options [nop,nop,TS val 395422 ecr 190971073], length 0
22:39:30.048019 IP 202.153.32.19.443 > 192.168.43.116.34204: Flags [.], seq 78848:80256, ack 1, win 135, options [nop,nop,TS val 190971073 ecr 395397], length 1408
22:39:30.055213 IP 202.153.32.19.443 > 192.168.43.116.34204: Flags [.], seq 80256:81664, ack 1, win 135, options [nop,nop,TS val 190971073 ecr 395397], length 1408
22:39:30.055234 IP 192.168.43.116.34204 > 202.153.32.19.443: Flags [.], ack 81664, win 8106, options [nop,nop,TS val 395426 ecr 190971073], length 0
22:39:30.058288 IP 202.153.32.19.443 > 192.168.43.116.34204: Flags [.], seq 81664:83072, ack 1, win 135, options [nop,nop,TS val 190971073 ecr 395397], length 1408
22:39:30.058304 IP 202.153.32.19.443 > 192.168.43.116.34204: Flags [.], seq 83072:84480, ack 1, win 135, options [nop,nop,TS val 190971073 ecr 395397], length 1408
22:39:30.058313 IP 192.168.43.116.34204 > 202.153.32.19.443: Flags [.], ack 84480, win 8106, options [nop,nop,TS val 395427 ecr 190971073], length 0
22:39:30.058318 IP 202.153.32.19.443 > 192.168.43.116.34204: Flags [.], seq 84480:85888, ack 1, win 135, options [nop,nop,TS val 190971088 ecr 395403], length 1408
22:39:30.066026 IP 202.153.32.19.443 > 192.168.43.116.34204: Flags [.], seq 85888:87296, ack 1, win 135, options [nop,nop,TS val 190971088 ecr 395403], length 1408
22:39:30.066051 IP 192.168.43.116.34204 > 202.153.32.19.443: Flags [.], ack 87296, win 8106, options [nop,nop,TS val 395429 ecr 190971088], length 0
22:39:30.146351 IP 202.153.32.19.443 > 192.168.43.116.34204: Flags [.], seq 87296:88704, ack 1, win 135, options [nop,nop,TS val 190971157 ecr 395418], length 1408
22:39:30.146373 IP 202.153.32.19.443 > 192.168.43.116.34204: Flags [.], seq 88704:90112, ack 1, win 135, options [nop,nop,TS val 190971157 ecr 395418], length 1408
22:39:30.146385 IP 192.168.43.116.34204 > 202.153.32.19.443: Flags [.], ack 90112, win 8106, options [nop,nop,TS val 395449 ecr 190971157], length 0
22:39:30.146600 IP 202.153.32.19.443 > 192.168.43.116.34204: Flags [.], seq 90112:91520, ack 1, win 135, options [nop,nop,TS val 190971163 ecr 395418], length 1408
22:39:30.146610 IP 202.153.32.19.443 > 192.168.43.116.34204: Flags [.], seq 91520:92928, ack 1, win 135, options [nop,nop,TS val 190971163 ecr 395418], length 1408
22:39:30.146616 IP 192.168.43.116.34204 > 202.153.32.19.443: Flags [.], ack 92928, win 8106, options [nop,nop,TS val 395449 ecr 190971163], length 0
22:39:30.152306 IP 202.153.32.19.443 > 192.168.43.116.34204: Flags [.], seq 92928:94336, ack 1, win 135, options [nop,nop,TS val 190971177 ecr 395422], length 1408
