22:49:47.636261 IP 192.168.43.116.58900 > 216.58.197.66.443: Flags [P.], seq 3303874905:3303874951, ack 1652673734, win 254, options [nop,nop,TS val 549821 ecr 2667309253], length 46
22:49:47.690992 IP 216.58.197.66.443 > 192.168.43.116.58900: Flags [P.], seq 1:47, ack 46, win 362, options [nop,nop,TS val 2667368098 ecr 549821], length 46
22:49:47.691030 IP 192.168.43.116.58900 > 216.58.197.66.443: Flags [.], ack 47, win 254, options [nop,nop,TS val 549835 ecr 2667368098], length 0
22:49:50.637867 IP 192.168.43.116.58498 > 74.125.68.93.443: Flags [P.], seq 2159211075:2159211121, ack 926829743, win 362, options [nop,nop,TS val 550572 ecr 2399886761], length 46
22:49:50.819812 IP 74.125.68.93.443 > 192.168.43.116.58498: Flags [.], ack 46, win 370, options [nop,nop,TS val 2399945262 ecr 550572], length 0
22:49:50.819831 IP 74.125.68.93.443 > 192.168.43.116.58498: Flags [P.], seq 1:47, ack 46, win 370, options [nop,nop,TS val 2399945262 ecr 550572], length 46
22:49:50.819841 IP 192.168.43.116.58498 > 74.125.68.93.443: Flags [.], ack 47, win 362, options [nop,nop,TS val 550617 ecr 2399945262], length 0
22:49:57.639658 IP 192.168.43.116.39158 > 172.217.26.202.443: Flags [P.], seq 1268246401:1268246447, ack 4022918694, win 318, options [nop,nop,TS val 552322 ecr 2493596782], length 46
22:49:57.725375 IP 172.217.26.202.443 > 192.168.43.116.39158: Flags [.], ack 46, win 349, options [nop,nop,TS val 2493655337 ecr 552322], length 0
22:49:57.725396 IP 172.217.26.202.443 > 192.168.43.116.39158: Flags [P.], seq 1:61, ack 46, win 349, options [nop,nop,TS val 2493655337 ecr 552322], length 60
22:49:57.725407 IP 192.168.43.116.39158 > 172.217.26.202.443: Flags [.], ack 61, win 318, options [nop,nop,TS val 552343 ecr 2493655337], length 0
22:49:57.725556 IP 192.168.43.116.39158 > 172.217.26.202.443: Flags [P.], seq 46:92, ack 61, win 318, options [nop,nop,TS val 552344 ecr 2493655337], length 46
22:49:57.725670 IP 192.168.43.116.39158 > 172.217.26.202.443: Flags [FP.], seq 92:123, ack 61, win 318, options [nop,nop,TS val 552344 ecr 2493655337], length 31
22:49:57.743691 IP 172.217.26.202.443 > 192.168.43.116.39158: Flags [F.], seq 61, ack 46, win 349, options [nop,nop,TS val 2493655337 ecr 552322], length 0
22:49:57.743718 IP 192.168.43.116.39158 > 172.217.26.202.443: Flags [.], ack 62, win 318, options [nop,nop,TS val 552348 ecr 2493655337], length 0
22:49:57.760477 IP 172.217.26.202.443 > 192.168.43.116.39158: Flags [R], seq 4022918754, win 0, length 0
22:49:57.779774 IP 172.217.26.202.443 > 192.168.43.116.39158: Flags [R], seq 4022918754, win 0, length 0
22:49:57.779787 IP 172.217.26.202.443 > 192.168.43.116.39158: Flags [R], seq 4022918755, win 0, length 0
22:50:19.640599 IP 192.168.43.116.60564 > 192.229.179.87.443: Flags [P.], seq 3183145560:3183145606, ack 3910511487, win 521, options [nop,nop,TS val 557822 ecr 73809015], length 46
22:50:19.917567 IP 192.168.43.116.60564 > 192.229.179.87.443: Flags [P.], seq 0:46, ack 1, win 521, options [nop,nop,TS val 557892 ecr 73809015], length 46
22:50:19.985465 IP 192.229.179.87.443 > 192.168.43.116.60564: Flags [.], ack 46, win 287, options [nop,nop,TS val 73823788 ecr 557892,nop,nop,sack 1 {0:46}], length 0
22:50:19.985486 IP 192.229.179.87.443 > 192.168.43.116.60564: Flags [P.], seq 1:47, ack 46, win 287, options [nop,nop,TS val 73823788 ecr 557822], length 46
22:50:19.985497 IP 192.168.43.116.60564 > 192.229.179.87.443: Flags [.], ack 47, win 521, options [nop,nop,TS val 557909 ecr 73823788], length 0
22:50:25.666806 IP 192.168.43.116.58900 > 216.58.197.66.443: Flags [P.], seq 46:760, ack 47, win 254, options [nop,nop,TS val 559329 ecr 2667368098], length 714
22:50:25.667115 IP 192.168.43.116.58900 > 216.58.197.66.443: Flags [.], seq 760:2128, ack 47, win 254, options [nop,nop,TS val 559329 ecr 2667368098], length 1368
22:50:25.748157 IP 192.168.43.116.58900 > 216.58.197.66.443: Flags [P.], seq 2128:2232, ack 47, win 254, options [nop,nop,TS val 559349 ecr 2667368098], length 104
22:50:25.822914 IP 216.58.197.66.443 > 192.168.43.116.58900: Flags [.], ack 2128, win 404, options [nop,nop,TS val 2667406217 ecr 559329], length 0
22:50:25.853726 IP 216.58.197.66.443 > 192.168.43.116.58900: Flags [P.], seq 47:121, ack 2232, win 404, options [nop,nop,TS val 2667406249 ecr 559349], length 74
22:50:25.853759 IP 192.168.43.116.58900 > 216.58.197.66.443: Flags [.], ack 121, win 254, options [nop,nop,TS val 559376 ecr 2667406249], length 0
22:50:25.853779 IP 216.58.197.66.443 > 192.168.43.116.58900: Flags [P.], seq 121:167, ack 2232, win 404, options [nop,nop,TS val 2667406249 ecr 559349], length 46
22:50:25.853783 IP 192.168.43.116.58900 > 216.58.197.66.443: Flags [.], ack 167, win 254, options [nop,nop,TS val 559376 ecr 2667406249], length 0
22:50:25.853829 IP 216.58.197.66.443 > 192.168.43.116.58900: Flags [P.], seq 167:218, ack 2232, win 404, options [nop,nop,TS val 2667406253 ecr 559349], length 51
22:50:25.853833 IP 192.168.43.116.58900 > 216.58.197.66.443: Flags [.], ack 218, win 254, options [nop,nop,TS val 559376 ecr 2667406253], length 0
22:50:25.853835 IP 216.58.197.66.443 > 192.168.43.116.58900: Flags [P.], seq 218:269, ack 2232, win 404, options [nop,nop,TS val 2667406255 ecr 559349], length 51
22:50:25.853837 IP 192.168.43.116.58900 > 216.58.197.66.443: Flags [.], ack 269, win 254, options [nop,nop,TS val 559376 ecr 2667406255], length 0
22:50:25.854113 IP 192.168.43.116.58900 > 216.58.197.66.443: Flags [P.], seq 2232:2278, ack 269, win 254, options [nop,nop,TS val 559376 ecr 2667406255], length 46
22:50:25.927002 IP 216.58.197.66.443 > 192.168.43.116.58900: Flags [.], ack 2278, win 404, options [nop,nop,TS val 2667406338 ecr 559376], length 0
22:50:28.824661 IP 192.168.43.116.36160 > 74.220.215.235.80: Flags [S], seq 3544320219, win 29200, options [mss 1460,sackOK,TS val 560118 ecr 0,nop,wscale 7], length 0
22:50:29.821563 IP 192.168.43.116.36160 > 74.220.215.235.80: Flags [S], seq 3544320219, win 29200, options [mss 1460,sackOK,TS val 560368 ecr 0,nop,wscale 7], length 0
22:50:30.002032 IP 74.220.215.235.80 > 192.168.43.116.36160: Flags [S.], seq 3757108925, ack 3544320220, win 28960, options [mss 1420,sackOK,TS val 1174546232 ecr 560118,nop,wscale 7], length 0
22:50:30.002086 IP 192.168.43.116.36160 > 74.220.215.235.80: Flags [.], ack 1, win 229, options [nop,nop,TS val 560413 ecr 1174546232], length 0
22:50:30.482525 IP 74.220.215.235.80 > 192.168.43.116.36160: Flags [S.], seq 3757108925, ack 3544320220, win 28960, options [mss 1420,sackOK,TS val 1174547355 ecr 560118,nop,wscale 7], length 0
22:50:30.482618 IP 192.168.43.116.36160 > 74.220.215.235.80: Flags [.], ack 1, win 229, options [nop,nop,TS val 560533 ecr 1174546232], length 0
22:50:32.654255 IP 192.168.43.116.49744 > 104.19.196.102.443: Flags [P.], seq 427867783:427867829, ack 2887745984, win 1633, length 46
22:50:32.750857 IP 104.19.196.102.443 > 192.168.43.116.49744: Flags [.], ack 46, win 32, length 0
22:50:32.750987 IP 104.19.196.102.443 > 192.168.43.116.49744: Flags [P.], seq 1:47, ack 46, win 32, length 46
22:50:32.751049 IP 192.168.43.116.49744 > 104.19.196.102.443: Flags [.], ack 47, win 1633, length 0
22:50:35.002391 IP 192.168.43.116.36160 > 74.220.215.235.80: Flags [F.], seq 1, ack 1, win 229, options [nop,nop,TS val 561663 ecr 1174546232], length 0
22:50:35.290096 IP 74.220.215.235.80 > 192.168.43.116.36160: Flags [F.], seq 1, ack 1, win 227, options [nop,nop,TS val 1174552370 ecr 560533], length 0
22:50:35.290121 IP 192.168.43.116.36160 > 74.220.215.235.80: Flags [.], ack 2, win 229, options [nop,nop,TS val 561735 ecr 1174552370], length 0
22:50:35.328004 IP 74.220.215.235.80 > 192.168.43.116.36160: Flags [.], ack 2, win 227, options [nop,nop,TS val 1174552420 ecr 561663], length 0
22:50:49.655444 IP 192.168.43.116.58498 > 74.125.68.93.443: Flags [P.], seq 46:92, ack 47, win 362, options [nop,nop,TS val 565326 ecr 2399945262], length 46
22:50:49.779989 IP 74.125.68.93.443 > 192.168.43.116.58498: Flags [P.], seq 47:93, ack 92, win 370, options [nop,nop,TS val 2400004237 ecr 565326], length 46
22:50:49.780100 IP 192.168.43.116.58498 > 74.125.68.93.443: Flags [.], ack 93, win 362, options [nop,nop,TS val 565357 ecr 2400004237], length 0
22:51:15.948619 IP 192.168.43.116.36162 > 74.220.215.235.80: Flags [S], seq 862496737, win 29200, options [mss 1460,sackOK,TS val 571899 ecr 0,nop,wscale 7], length 0
22:51:16.018366 IP 192.168.43.116.36164 > 74.220.215.235.80: Flags [S], seq 3339971105, win 29200, options [mss 1460,sackOK,TS val 571917 ecr 0,nop,wscale 7], length 0
